{
  "schema_version": "1.0",
  "project_id": "11111111-1111-4111-8111-111111111111",
  "revision_id": "33333333-3333-4333-8333-333333333333",
  "tests": [
    {
      "id": "AC-RTL-01",
      "requirement_keys": [
        "channels"
      ],
      "level": "eda",
      "fixture": "independent-pattern",
      "expected": "16 channels in little-endian sample order",
      "blocking": true,
      "protected": true,
      "timeout_seconds": 120
    },
    {
      "id": "AC-RTL-02",
      "requirement_keys": [
        "sample_rate"
      ],
      "level": "eda",
      "fixture": "clock-enable-boundaries",
      "expected": "sample every10 cycles",
      "blocking": true,
      "protected": true,
      "timeout_seconds": 120
    }
  ]
}
